[
  {
    "id": "att-home-001",
    "provider": "att",
    "category": "pre-sales",
    "question_variants": [
      "AT&T 家庭宽带有哪些套餐",
      "AT&T 住家宽带套餐选择",
      "AT&T Fiber 家庭套餐"
    ],
    "answer": "AT&T 家庭宽带提供多种套餐选择，包括 AT&T Fiber 光纤套餐。具体套餐和速度取决于您的地址覆盖情况。AT&T Fiber 上传速度快，适合远程办公。建议加微信提供地址，我们帮您查询可用的套餐选项。",
    "scope": "allowed",
    "next_step": "加微信提供地址查询可用套餐",
    "do_not_say": [
      "$",
      "价格",
      "多少钱",
      "最便宜",
      "促销"
    ],
    "source_url": "/internet/att-fiber",
    "updated_at": "2026-01-27T00:00:00Z",
    "review_status": "time_sensitive"
  },
  {
    "id": "att-home-002",
    "provider": "att",
    "category": "coverage",
    "question_variants": [
      "我的地址能装 AT&T 吗",
      "AT&T Fiber 覆盖查询",
      "AT&T 地址覆盖"
    ],
    "answer": "地址覆盖需要具体查询。我们可以帮您免费查询地址覆盖情况。建议加微信提供详细地址，我们会在 1 分钟内告诉您该地址是否支持 AT&T Fiber。",
    "scope": "blocked",
    "next_step": "加微信提供地址查询",
    "do_not_say": [
      "能装",
      "不能装",
      "100%",
      "保证",
      "确定"
    ],
    "source_url": "/internet/att-fiber",
    "updated_at": "2026-01-27T00:00:00Z",
    "review_status": "time_sensitive"
  },
  {
    "id": "att-home-003",
    "provider": "att",
    "category": "installation",
    "question_variants": [
      "AT&T 安装需要多久",
      "AT&T Fiber 安装时间",
      "AT&T 多久能装好"
    ],
    "answer": "AT&T Fiber 安装通常需要 1-3 个工作日。具体时间取决于您的地址和运营商安排。我们会帮您预约最快的安装时间，并全程跟踪安装进度。",
    "scope": "allowed",
    "next_step": "加微信预约安装时间",
    "do_not_say": [
      "保证",
      "确定",
      "一定"
    ],
    "source_url": "/internet/att-fiber",
    "updated_at": "2026-01-27T00:00:00Z",
    "review_status": "time_sensitive"
  },
  {
    "id": "att-home-004",
    "provider": "att",
    "category": "billing",
    "question_variants": [
      "AT&T 为什么涨价",
      "AT&T 账单涨价原因",
      "AT&T Fiber 为什么账单不一样"
    ],
    "answer": "AT&T ??????????????AutoPay ??????????????????????????????????????????????????????????????????????????????? AT&T ???????",
    "scope": "allowed",
    "next_step": "加微信协助处理账单问题",
    "do_not_say": [
      "$",
      "具体金额",
      "保证"
    ],
    "source_url": "/internet/att-fiber",
    "updated_at": "2026-01-27T00:00:00Z",
    "review_status": "time_sensitive",
    "stage": "bill-check",
    "case_type": "common-question",
    "tags": [
      "???? / ????",
      "att",
      "?????"
    ],
    "summary": "AT&T ????????????????????????????????????",
    "check_first": [
      "????????????????",
      "?????AutoPay ???????",
      "???????????????????"
    ],
    "self_help": [
      "??????????????",
      "??????????????",
      "??????????????????"
    ],
    "cannot_determine": [
      "??????????????",
      "???????????",
      "?????????????"
    ]
  },
  {
    "id": "att-home-005",
    "provider": "att",
    "category": "no-ssn",
    "question_variants": [
      "没有 SSN 可以办 AT&T 吗",
      "无 SSN 办 AT&T",
      "AT&T 无 SSN 办理"
    ],
    "answer": "可以。我们支持无 SSN 办理 AT&T 宽带服务。部分运营商可能需要押金或预付费，我们会帮您选择最适合的无 SSN 办理方案。具体情况需要人工确认，建议加微信详细咨询。",
    "scope": "allowed",
    "next_step": "加微信确认无 SSN 办理可行性",
    "do_not_say": [
      "保证",
      "一定",
      "100%",
      "不需要押金"
    ],
    "source_url": "/internet/att-fiber",
    "updated_at": "2026-01-27T00:00:00Z",
    "review_status": "time_sensitive"
  },
  {
    "id": "att-home-006",
    "provider": "att",
    "category": "contract",
    "question_variants": [
      "AT&T 有合约吗",
      "AT&T Fiber 需要签合约吗",
      "AT&T 合约期限"
    ],
    "answer": "AT&T Fiber 大部分套餐无合约，可随时取消。部分促销套餐可能有 12-24 个月合约，但通常可以提前解约。我们会详细说明合约条款。",
    "scope": "allowed",
    "next_step": "加微信了解具体合约条款",
    "do_not_say": [
      "保证",
      "一定"
    ],
    "source_url": "/internet/att-fiber",
    "updated_at": "2026-01-27T00:00:00Z",
    "review_status": "time_sensitive"
  },
  {
    "id": "att-home-007",
    "provider": "att",
    "category": "moving",
    "question_variants": [
      "AT&T 搬家可以转移吗",
      "AT&T Fiber 搬家宽带",
      "AT&T 服务转移"
    ],
    "answer": "可以。AT&T 支持服务转移，但需要确认新地址有覆盖。转移通常免费或收取少量费用。我们会帮您处理转移流程，并确认新地址的套餐和价格。",
    "scope": "allowed",
    "next_step": "加微信提供新地址处理转移",
    "do_not_say": [
      "$",
      "具体费用",
      "保证"
    ],
    "source_url": "/internet/att-fiber",
    "updated_at": "2026-01-27T00:00:00Z",
    "review_status": "time_sensitive"
  },
  {
    "id": "att-home-008",
    "provider": "att",
    "category": "equipment",
    "question_variants": [
      "AT&T 需要买路由器吗",
      "AT&T Fiber 设备费用",
      "AT&T Modem 租赁"
    ],
    "answer": "AT&T 通常提供 Modem 租赁服务。您可以自备兼容的路由器节省月费。我们会帮您确认设备兼容性，并推荐性价比高的路由器选择。",
    "scope": "allowed",
    "next_step": "加微信了解设备选择",
    "do_not_say": [
      "$",
      "具体价格"
    ],
    "source_url": "/internet/att-fiber",
    "updated_at": "2026-01-27T00:00:00Z",
    "review_status": "time_sensitive"
  }
]
