[
  {
    "id": "general-001",
    "provider": "general",
    "category": "billing",
    "question_variants": [
      "宽带为什么涨价",
      "账单涨价原因",
      "为什么第一年便宜第二年涨价"
    ],
    "answer": "????????????????AutoPay ????????????????????????????????????????????????????????????????????????????????????????",
    "scope": "allowed",
    "next_step": "加微信协助处理账单问题",
    "do_not_say": [
      "$",
      "具体金额",
      "保证"
    ],
    "source_url": "/internet",
    "updated_at": "2026-01-27T00:00:00Z",
    "review_status": "time_sensitive",
    "stage": "bill-check",
    "case_type": "common-question",
    "tags": [
      "???? / ????",
      "general",
      "?????"
    ],
    "summary": "??????????????????????????????????????",
    "check_first": [
      "????????????????",
      "?????AutoPay ???????",
      "???????????????????"
    ],
    "self_help": [
      "??????????????",
      "??????????????",
      "??????????????????"
    ],
    "cannot_determine": [
      "??????????????",
      "???????????",
      "?????????????"
    ]
  },
  {
    "id": "general-002",
    "provider": "general",
    "category": "installation",
    "question_variants": [
      "宽带安装需要多久",
      "安装时间",
      "多久能装好"
    ],
    "answer": "宽带安装通常需要 1-3 个工作日。具体时间取决于运营商和地址。我们会帮您预约最快的安装时间，并全程跟踪安装进度。",
    "scope": "allowed",
    "next_step": "加微信预约安装时间",
    "do_not_say": [
      "保证",
      "确定",
      "一定"
    ],
    "source_url": "/internet",
    "updated_at": "2026-01-27T00:00:00Z",
    "review_status": "time_sensitive"
  },
  {
    "id": "general-003",
    "provider": "general",
    "category": "moving",
    "question_variants": [
      "搬家可以转移宽带吗",
      "搬家宽带",
      "服务转移"
    ],
    "answer": "可以。大部分运营商支持服务转移，但需要确认新地址有覆盖。转移通常免费或收取少量费用。我们会帮您处理转移流程，并确认新地址的套餐和价格。",
    "scope": "allowed",
    "next_step": "加微信提供新地址处理转移",
    "do_not_say": [
      "$",
      "具体费用",
      "保证"
    ],
    "source_url": "/internet",
    "updated_at": "2026-01-27T00:00:00Z",
    "review_status": "time_sensitive"
  },
  {
    "id": "general-004",
    "provider": "general",
    "category": "contract",
    "question_variants": [
      "宽带有合约吗",
      "需要签合约吗",
      "合约期限"
    ],
    "answer": "大部分宽带套餐无合约，可随时取消。部分促销套餐可能有 12-24 个月合约，但通常可以提前解约。我们会详细说明合约条款。",
    "scope": "allowed",
    "next_step": "加微信了解具体合约条款",
    "do_not_say": [
      "保证",
      "一定"
    ],
    "source_url": "/internet",
    "updated_at": "2026-01-27T00:00:00Z",
    "review_status": "time_sensitive"
  },
  {
    "id": "general-005",
    "provider": "general",
    "category": "no-ssn",
    "question_variants": [
      "没有 SSN 可以办宽带吗",
      "无 SSN 办宽带",
      "无 SSN 办理"
    ],
    "answer": "可以。我们支持无 SSN 办理宽带服务。部分运营商可能需要押金或预付费，我们会帮您选择最适合的无 SSN 办理方案。具体情况需要人工确认，建议加微信详细咨询。",
    "scope": "allowed",
    "next_step": "加微信确认无 SSN 办理可行性",
    "do_not_say": [
      "保证",
      "一定",
      "100%",
      "不需要押金"
    ],
    "source_url": "/internet",
    "updated_at": "2026-01-27T00:00:00Z",
    "review_status": "time_sensitive"
  },
  {
    "id": "general-006",
    "provider": "general",
    "category": "coverage",
    "question_variants": [
      "我的地址能装什么宽带",
      "地址覆盖查询",
      "能装哪些运营商"
    ],
    "answer": "地址覆盖需要具体查询。我们可以帮您免费查询地址覆盖情况。建议加微信提供详细地址，我们会在 1 分钟内告诉您该地址支持哪些运营商和套餐。",
    "scope": "blocked",
    "next_step": "加微信提供地址查询",
    "do_not_say": [
      "能装",
      "不能装",
      "100%",
      "保证",
      "确定"
    ],
    "source_url": "/internet",
    "updated_at": "2026-01-27T00:00:00Z",
    "review_status": "time_sensitive"
  },
  {
    "id": "general-007",
    "provider": "general",
    "category": "equipment",
    "question_variants": [
      "需要买路由器吗",
      "设备费用",
      "Modem 租赁"
    ],
    "answer": "运营商通常提供 Modem 租赁服务。您可以自备兼容的路由器节省月费。我们会帮您确认设备兼容性，并推荐性价比高的路由器选择。",
    "scope": "allowed",
    "next_step": "加微信了解设备选择",
    "do_not_say": [
      "$",
      "具体价格"
    ],
    "source_url": "/internet",
    "updated_at": "2026-01-27T00:00:00Z",
    "review_status": "time_sensitive"
  },
  {
    "id": "general-008",
    "provider": "general",
    "category": "pre-sales",
    "question_variants": [
      "宽带套餐怎么选",
      "如何选择宽带",
      "选哪个运营商好"
    ],
    "answer": "选择宽带套餐主要看：1) 家庭人数和设备数量 2) 使用场景（工作、娱乐、游戏）3) 预算。我们提供免费咨询，根据您的实际需求推荐最适合的套餐。建议加微信详细咨询。",
    "scope": "allowed",
    "next_step": "加微信根据需求推荐套餐",
    "do_not_say": [
      "$",
      "具体价格",
      "最便宜",
      "保证"
    ],
    "source_url": "/internet",
    "updated_at": "2026-01-27T00:00:00Z",
    "review_status": "time_sensitive"
  }
]
