[
  {
    "id": "xfinity-home-001",
    "provider": "xfinity",
    "category": "pre-sales",
    "question_variants": [
      "Xfinity 家庭宽带有哪些套餐",
      "Xfinity 住家宽带套餐选择",
      "Xfinity 家庭套餐有哪些"
    ],
    "answer": "Xfinity 家庭宽带提供多种套餐选择，包括基础套餐、高速套餐和超高速套餐。具体套餐和速度取决于您的地址覆盖情况。建议加微信提供地址，我们帮您查询可用的套餐选项。",
    "scope": "allowed",
    "next_step": "加微信提供地址查询可用套餐",
    "do_not_say": ["$", "价格", "多少钱", "最便宜", "促销"],
    "source_url": "/internet/xfinity",
    "updated_at": "2026-01-27T00:00:00Z"
  },
  {
    "id": "xfinity-home-002",
    "provider": "xfinity",
    "category": "coverage",
    "question_variants": [
      "我的地址能装 Xfinity 吗",
      "Xfinity 覆盖查询",
      "Xfinity 地址覆盖"
    ],
    "answer": "地址覆盖需要具体查询。我们可以帮您免费查询地址覆盖情况。建议加微信提供详细地址，我们会在 1 分钟内告诉您该地址是否支持 Xfinity。",
    "scope": "blocked",
    "next_step": "加微信提供地址查询",
    "do_not_say": ["能装", "不能装", "100%", "保证", "确定"],
    "source_url": "/internet/xfinity",
    "updated_at": "2026-01-27T00:00:00Z"
  },
  {
    "id": "xfinity-home-003",
    "provider": "xfinity",
    "category": "installation",
    "question_variants": [
      "Xfinity 安装需要多久",
      "Xfinity 安装时间",
      "Xfinity 多久能装好"
    ],
    "answer": "Xfinity 宽带安装通常需要 1-3 个工作日。具体时间取决于您的地址和运营商安排。我们会帮您预约最快的安装时间，并全程跟踪安装进度。",
    "scope": "allowed",
    "next_step": "加微信预约安装时间",
    "do_not_say": ["保证", "确定", "一定"],
    "source_url": "/internet/xfinity",
    "updated_at": "2026-01-27T00:00:00Z"
  },
  {
    "id": "xfinity-home-004",
    "provider": "xfinity",
    "category": "billing",
    "question_variants": [
      "Xfinity 为什么涨价",
      "Xfinity 账单涨价原因",
      "Xfinity 为什么账单不一样"
    ],
    "answer": "Xfinity 涨价通常是因为促销期（12-24 个月）结束，恢复到正常价格。这是正常情况。我们可以帮您联系 Xfinity 协商续约优惠，或对比其他运营商方案。通常可以帮您节省费用。",
    "scope": "allowed",
    "next_step": "加微信协助处理账单问题",
    "do_not_say": ["$", "具体金额", "保证"],
    "source_url": "/internet/xfinity",
    "updated_at": "2026-01-27T00:00:00Z"
  },
  {
    "id": "xfinity-home-005",
    "provider": "xfinity",
    "category": "contract",
    "question_variants": [
      "Xfinity 有合约吗",
      "Xfinity 需要签合约吗",
      "Xfinity 合约期限"
    ],
    "answer": "Xfinity 大部分套餐无合约，可随时取消。部分促销套餐可能有 12-24 个月合约，但通常可以提前解约。我们会详细说明合约条款。",
    "scope": "allowed",
    "next_step": "加微信了解具体合约条款",
    "do_not_say": ["保证", "一定"],
    "source_url": "/internet/xfinity",
    "updated_at": "2026-01-27T00:00:00Z"
  },
  {
    "id": "xfinity-home-006",
    "provider": "xfinity",
    "category": "equipment",
    "question_variants": [
      "Xfinity 需要买路由器吗",
      "Xfinity 设备费用",
      "Xfinity Modem 租赁"
    ],
    "answer": "Xfinity 通常提供 Modem 租赁服务。您可以自备兼容的路由器节省月费。我们会帮您确认设备兼容性，并推荐性价比高的路由器选择。",
    "scope": "allowed",
    "next_step": "加微信了解设备选择",
    "do_not_say": ["$", "具体价格"],
    "source_url": "/internet/xfinity",
    "updated_at": "2026-01-27T00:00:00Z"
  },
  {
    "id": "xfinity-home-007",
    "provider": "xfinity",
    "category": "moving",
    "question_variants": [
      "Xfinity 搬家可以转移吗",
      "Xfinity 搬家宽带",
      "Xfinity 服务转移"
    ],
    "answer": "可以。Xfinity 支持服务转移，但需要确认新地址有覆盖。转移通常免费或收取少量费用。我们会帮您处理转移流程，并确认新地址的套餐和价格。",
    "scope": "allowed",
    "next_step": "加微信提供新地址处理转移",
    "do_not_say": ["$", "具体费用", "保证"],
    "source_url": "/internet/xfinity",
    "updated_at": "2026-01-27T00:00:00Z"
  },
  {
    "id": "xfinity-home-008",
    "provider": "xfinity",
    "category": "after-sales",
    "question_variants": [
      "Xfinity 可以提前解约吗",
      "Xfinity 取消服务",
      "Xfinity 解约费用"
    ],
    "answer": "可以。无合约套餐可随时取消；有合约套餐通常可以提前解约，可能需要支付剩余设备费用。我们会帮您了解具体解约条款和费用。",
    "scope": "allowed",
    "next_step": "加微信了解解约流程",
    "do_not_say": ["$", "具体金额", "保证"],
    "source_url": "/internet/xfinity",
    "updated_at": "2026-01-27T00:00:00Z"
  }
]
