[
  {
    "id": "xfinity-equipment-return-charge-001",
    "provider": "xfinity",
    "category": "equipment",
    "question_variants": [
      "宽带设备已经退还，账单为什么还在收费？",
      "退了 Xfinity modem/router 后设备费仍出现怎么办？",
      "运营商收到退回设备了，但账单还有设备费用怎么查？"
    ],
    "answer": "先核对设备退还凭证、追踪记录、设备序列号和账户中的设备列表，再对比退还时间与账单周期。记录可能存在处理延迟，也可能是设备或账户关联未更新；应请运营商核查该设备是否已登记退回以及费用对应的计费周期。",
    "scope": "allowed",
    "next_step": "向运营商提供退还凭证和设备信息，申请核对设备状态及相关收费周期。",
    "do_not_say": [
      "退还后费用一定会自动退回",
      "一定是运营商错误",
      "无需保留收据"
    ],
    "updated_at": "2026-10-03T00:00:00Z",
    "stage": "bill-check",
    "case_type": "historical-question",
    "tags": [
      "账单涨价 / 费用异常",
      "宽带设备 / Wi-Fi / 故障",
      "设备退还"
    ],
    "summary": "退还设备后仍被收费时，应先核对退还凭证、设备登记和账单周期。",
    "check_first": [
      "设备退还收据或承运商追踪记录",
      "设备序列号和账户中的租赁设备列表",
      "账单收费对应的服务周期"
    ],
    "self_help": [
      "保存退还凭证和与运营商沟通的确认编号",
      "对比后续账单是否仍重复出现该项费用"
    ],
    "cannot_determine": [
      "设备是否已完成入库登记",
      "费用是否符合账户协议",
      "退款或账单调整资格及处理时间"
    ],
    "review_status": "approved",
    "public_case": true
  },
  {
    "id": "att-first-bill-higher-001",
    "provider": "att",
    "category": "billing",
    "question_variants": [
      "AT&T 第一张手机账单为什么比预期高？",
      "刚开 AT&T 手机服务，首月账单金额偏高怎么查？",
      "AT&T 首张账单多出费用，是长期月费还是一次性收费？"
    ],
    "answer": "首张账单可能同时包含不完整计费周期、开通或设备相关费用、税费、设备分期，以及尚未出现或延后显示的促销抵扣。应逐项对比服务周期、收费类型和促销明细，并在下一期账单核对是否重复；具体金额与抵扣资格需要按账户和订单核实。",
    "scope": "allowed",
    "next_step": "对照订单确认信息和账单明细，向 AT&T 核实未识别的收费或抵扣项目。",
    "do_not_say": [
      "首张账单一定会更贵",
      "所有抵扣都会在下一期出现",
      "费用一定会退还"
    ],
    "updated_at": "2026-10-03T00:00:00Z",
    "stage": "bill-check",
    "case_type": "historical-question",
    "tags": [
      "账单涨价 / 费用异常",
      "手机设备与分期",
      "AT&T 首账单"
    ],
    "summary": "AT&T 首账单偏高时，应区分计费周期、一次性收费、设备分期和促销抵扣。",
    "check_first": [
      "账单覆盖日期是否为完整周期",
      "新增费用是一次性还是每月重复",
      "设备分期和促销账单抵扣是否已列出"
    ],
    "self_help": [
      "将订单确认、促销条款与账单项目逐项对照",
      "在下期账单检查相关收费或抵扣是否继续出现"
    ],
    "cannot_determine": [
      "具体首账单金额是否正确",
      "促销抵扣何时生效及账户资格",
      "未识别费用能否调整"
    ],
    "review_status": "time_sensitive",
    "public_case": false
  }
]
